{
  "schema_id": "researchos-plugin-v1",
  "core_api_version": "1",
  "id": "alignment_stewardship",
  "version": "1.0.0",
  "enabled": true,
  "available_in": ["public_starter", "personal_vault"],
  "execution_profile": "declarative",
  "product_tier": "bundled_capability",
  "public_safe": true,
  "sensitivity_default": "local_only",
  "documentation": {"readme": "docs/plugins/alignment-stewardship/README.md"},
  "governance": {
    "schema_id": "researchos-plugin-governance-v1",
    "contract_id": "researchos.contribution.alignment_stewardship",
    "archetype": "capability_led",
    "distribution": {"variant": "public", "parity_policy": "scoped_variant", "allowed_divergence_fields": ["available_in", "public_safe", "authority", "governance.distribution.variant", "governance.data_policy", "governance.routing.handoff_to"]},
    "lineage": {"prototype_id": "researchos_plugin_capability_v1", "derivation_mode": "native", "reuse_policy": "native", "source_refs": [], "external_runtime_dependency": "none", "transformation_summary": "Public alignment uses current task evidence and explicit user statements without constructing a private profile.", "current_placement": "plugin", "proposed_absorption_target": "none", "absorption_gate": "review_required"},
    "capability_value": {"comparison_target": "current_model_without_capability", "comparison_status": "planned", "expected_deltas": ["reliability", "authority_safety", "efficiency"], "expected_burdens": ["context_cost", "trigger_risk"], "evidence_refs": [], "placement_decision": "pending_comparison", "retention_rule": "Retain only if bounded checkpoints reduce repeated correction without profiling."},
    "effects": {"default_effect": "answer", "allowed_effects": ["read_only", "answer", "artifact", "review_candidate"]},
    "data_policy": {"default_sensitivity": "inherit_runtime", "default_export_policy": "local_only"},
    "composition": {"requires": ["researchos_core"], "provides": ["collaborative_alignment"], "optional_integrations": ["research_audit", "system_reflection"], "conflicts_with": []},
    "capability_bindings": [{"contribution_id": "collaborative_alignment", "claim_ids": ["collaborative_alignment"]}],
    "task_projections": [],
    "routing": {"trigger_intents": ["explicit_alignment", "iteration_alignment", "authority_alignment"], "non_goals": ["psychological_profiling", "judgment_scoring", "parallel_task_memory"], "handoff_to": [{"kind": "capability", "id": "research_audit", "availability": "if_available"}, {"kind": "core_route", "id": "review", "availability": "required"}]},
    "admission": {"maturity": "instrumented", "proof_refs": ["evals/test_public_capability_alignment.py"], "last_reviewed": "2026-08-25", "revalidation_triggers": ["alignment_route_change", "human_authority_change", "model_baseline_change"], "retirement_condition": "Retire if bounded alignment no longer improves consequence prediction."}
  },
  "authority": {"source": "The current user statement and supplied task evidence remain authority.", "candidate": "The shared task model remains a current working candidate.", "confirmation": "The user retains goal, value, and consequence authority.", "save_target": "Use answer or Review; this plugin owns no profile or storage.", "requires_human_confirmation": true, "writeback_route": "review", "storage_owner": "researchos_core"},
  "permissions": {"read_paths": [], "network_domains": [], "command_ids": [], "state_access": "none", "canonical_write": false},
  "contributions": {"tasks": [], "actions": [], "candidate_types": [{"id": "alignment_checkpoint"}], "asset_types": [], "source_adapters": [], "previewers": [], "projections": [], "ui_slots": [], "work_item_providers": []},
  "state_namespace": "researchos.plugin.alignment_stewardship",
  "lifecycle": {"install": "release_bundled", "enable": "manifest_flag", "disable": "manifest_flag", "uninstall": "release_change", "migrations": []},
  "validation": {"commands": ["python3 scripts/validate_plugins.py"], "behavior_tests": ["python3 -m unittest evals.test_public_capability_alignment"]}
}
