{
  "schema_id": "researchos-plugin-v1",
  "core_api_version": "1",
  "id": "reflection_stewardship",
  "version": "1.1.1",
  "enabled": true,
  "available_in": ["public_starter", "personal_vault"],
  "execution_profile": "declarative",
  "product_tier": "bundled_capability",
  "public_safe": true,
  "sensitivity_default": "local_only",
  "documentation": {"readme": "docs/plugins/reflection-stewardship/README.md"},
  "governance": {
    "schema_id": "researchos-plugin-governance-v1",
    "contract_id": "researchos.contribution.reflection_stewardship",
    "archetype": "capability_led",
    "distribution": {
      "variant": "public",
      "parity_policy": "scoped_variant",
      "allowed_divergence_fields": [
        "available_in",
        "public_safe",
        "sensitivity_default",
        "authority",
        "governance.distribution.variant",
        "governance.capability_value.expected_deltas",
        "governance.data_policy",
        "governance.composition.optional_integrations",
        "governance.task_projections",
        "governance.routing.handoff_to",
        "governance.admission.proof_refs",
        "governance.admission.revalidation_triggers",
        "contributions.tasks",
        "contributions.candidate_types",
        "lifecycle.migrations",
        "validation"
      ]
    },
    "lineage": {"prototype_id": "researchos_plugin_capability_v1", "derivation_mode": "native", "reuse_policy": "native", "source_refs": [], "external_runtime_dependency": "none", "transformation_summary": "Native episode-reflection capability linked to the core judgment-calibration loop without acquiring decision authority.", "current_placement": "plugin", "proposed_absorption_target": "none", "absorption_gate": "review_required"},
    "capability_value": {"comparison_target": "current_model_without_capability", "comparison_status": "planned", "expected_deltas": ["reliability", "recoverability"], "expected_burdens": ["context_cost", "trigger_risk"], "evidence_refs": [], "placement_decision": "pending_comparison", "retention_rule": "Retain as a plugin only if episode reflection produces reusable bounded rule changes without manufacturing parallel memory."},
    "effects": {"default_effect": "answer", "allowed_effects": ["read_only", "answer", "artifact", "review_candidate"]},
    "data_policy": {"default_sensitivity": "inherit_runtime", "default_export_policy": "local_only"},
    "composition": {"requires": ["researchos_core"], "provides": ["system_reflection"], "optional_integrations": [], "conflicts_with": []},
    "capability_bindings": [{"contribution_id": "system_reflection", "claim_ids": ["system_reflection"]}],
    "task_projections": [],
    "routing": {"trigger_intents": ["episode_reflection", "root_cause_reflection", "knowledge_delta"], "non_goals": ["live_project_audit", "deterministic_health_check", "plain_content_writeback", "parallel_memory_creation", "automatic_rule_admission"], "handoff_to": [{"kind": "core_route", "id": "review", "availability": "required"}]},
    "admission": {"maturity": "instrumented", "proof_refs": ["evals/test_public_capability_alignment.py"], "last_reviewed": "2026-08-28", "revalidation_triggers": ["reflection_route_change", "plain_writeback_boundary_change", "public_boundary_change", "rule_owner_change", "model_baseline_change"], "retirement_condition": "Retire if one bounded episode can no longer produce an evidence-marked lesson and one owned executable gate."}
  },
  "authority": {"source": "The supplied episode receipt and observable outcome remain authority.", "candidate": "Lessons and rule changes remain candidates.", "confirmation": "Human Review is required before a lesson becomes a durable rule.", "save_target": "Use answer or Review; this plugin owns no memory.", "requires_human_confirmation": true, "writeback_route": "review", "storage_owner": "researchos_core"},
  "permissions": {"read_paths": [], "network_domains": [], "command_ids": [], "state_access": "none", "canonical_write": false},
  "contributions": {"tasks": [], "actions": [], "candidate_types": [{"id": "reflection_lesson"}], "asset_types": [], "source_adapters": [], "previewers": [], "projections": [], "ui_slots": [], "work_item_providers": []},
  "state_namespace": "researchos.plugin.reflection_stewardship",
  "lifecycle": {"install": "release_bundled", "enable": "manifest_flag", "disable": "manifest_flag", "uninstall": "release_change", "migrations": []},
  "validation": {"commands": ["python3 scripts/validate_plugins.py"], "behavior_tests": ["python3 -m unittest evals.test_public_capability_alignment"]}
}
