{
  "schema_id": "researchos-plugin-v1",
  "core_api_version": "1",
  "id": "audit_stewardship",
  "version": "1.0.0",
  "enabled": true,
  "available_in": ["public_starter", "personal_vault"],
  "execution_profile": "declarative",
  "product_tier": "bundled_capability",
  "public_safe": true,
  "sensitivity_default": "local_only",
  "documentation": {"readme": "docs/plugins/audit-stewardship/README.md"},
  "governance": {
    "schema_id": "researchos-plugin-governance-v1",
    "contract_id": "researchos.contribution.audit_stewardship",
    "archetype": "capability_led",
    "distribution": {"variant": "public", "parity_policy": "scoped_variant", "allowed_divergence_fields": ["available_in", "public_safe", "authority", "governance.distribution.variant", "governance.data_policy", "governance.routing.handoff_to"]},
    "lineage": {"prototype_id": "researchos_plugin_capability_v1", "derivation_mode": "native", "reuse_policy": "native", "source_refs": [], "external_runtime_dependency": "none", "transformation_summary": "Public audits operate on an exact user-selected scope and return reversible repair candidates.", "current_placement": "plugin", "proposed_absorption_target": "none", "absorption_gate": "review_required"},
    "capability_value": {"comparison_target": "current_model_without_capability", "comparison_status": "planned", "expected_deltas": ["evidence_boundary", "authority_safety", "recoverability"], "expected_burdens": ["context_cost", "maintenance_cost"], "evidence_refs": [], "placement_decision": "pending_comparison", "retention_rule": "Retain only if bounded audits catch consequential errors better than an unconstrained review."},
    "effects": {"default_effect": "answer", "allowed_effects": ["read_only", "answer", "artifact", "review_candidate"]},
    "data_policy": {"default_sensitivity": "inherit_runtime", "default_export_policy": "local_only"},
    "composition": {"requires": ["researchos_core"], "provides": ["research_audit"], "optional_integrations": ["collaborative_alignment", "system_reflection", "self_evolution"], "conflicts_with": []},
    "capability_bindings": [{"contribution_id": "research_audit", "claim_ids": ["research_audit"]}],
    "task_projections": [],
    "routing": {"trigger_intents": ["project_audit", "transition_audit", "evidence_audit", "safe_cleanup"], "non_goals": ["irreversible_cleanup", "canonical_direct_write", "automatic_external_action"], "handoff_to": [{"kind": "task", "id": "system_evolution_review", "availability": "if_available"}, {"kind": "core_route", "id": "review", "availability": "required"}]},
    "admission": {"maturity": "instrumented", "proof_refs": ["evals/test_public_capability_alignment.py"], "last_reviewed": "2026-08-25", "revalidation_triggers": ["audit_route_change", "cleanup_authority_change", "model_baseline_change"], "retirement_condition": "Retire if bounded evidence and recoverability can no longer be enforced."}
  },
  "authority": {"source": "The selected source, repository state, and explicit baseline remain authority.", "candidate": "Findings and repairs remain candidates until reviewed.", "confirmation": "Human confirmation is required before any mutation or public claim.", "save_target": "Use answer, artifact, or Review; this plugin owns no storage.", "requires_human_confirmation": true, "writeback_route": "review", "storage_owner": "researchos_core"},
  "permissions": {"read_paths": [], "network_domains": [], "command_ids": [], "state_access": "none", "canonical_write": false},
  "contributions": {"tasks": [], "actions": [], "candidate_types": [{"id": "audit_finding"}], "asset_types": [], "source_adapters": [], "previewers": [], "projections": [], "ui_slots": [], "work_item_providers": []},
  "state_namespace": "researchos.plugin.audit_stewardship",
  "lifecycle": {"install": "release_bundled", "enable": "manifest_flag", "disable": "manifest_flag", "uninstall": "release_change", "migrations": []},
  "validation": {"commands": ["python3 scripts/validate_plugins.py"], "behavior_tests": ["python3 -m unittest evals.test_public_capability_alignment"]}
}
