{
  "schema_id": "researchos-plugin-v1",
  "core_api_version": "1",
  "id": "research_context",
  "version": "1.0.0",
  "enabled": true,
  "available_in": ["public_starter", "personal_vault"],
  "execution_profile": "declarative",
  "product_tier": "bundled_capability",
  "public_safe": true,
  "sensitivity_default": "local_only",
  "documentation": {"readme": "docs/plugins/research-context/README.md"},
  "governance": {
    "schema_id": "researchos-plugin-governance-v1",
    "contract_id": "researchos.contribution.research_context",
    "archetype": "capability_led",
    "distribution": {"variant": "public", "parity_policy": "scoped_variant", "allowed_divergence_fields": ["available_in", "public_safe", "authority", "governance.distribution.variant", "governance.data_policy", "governance.routing.handoff_to"]},
    "lineage": {"prototype_id": "researchos_plugin_capability_v1", "derivation_mode": "native", "reuse_policy": "native", "source_refs": [], "external_runtime_dependency": "none", "transformation_summary": "Public-safe context routing uses only public files or paths explicitly selected by the user.", "current_placement": "plugin", "proposed_absorption_target": "none", "absorption_gate": "review_required"},
    "capability_value": {"comparison_target": "current_model_without_capability", "comparison_status": "planned", "expected_deltas": ["efficiency", "authority_safety"], "expected_burdens": ["context_cost", "maintenance_cost"], "evidence_refs": [], "placement_decision": "pending_comparison", "retention_rule": "Retain only if bounded routing reduces unnecessary reads without discovering private sibling data."},
    "effects": {"default_effect": "answer", "allowed_effects": ["read_only", "answer", "artifact", "review_candidate"]},
    "data_policy": {"default_sensitivity": "inherit_runtime", "default_export_policy": "public_safe"},
    "composition": {"requires": ["researchos_core"], "provides": ["research_context_routes"], "optional_integrations": ["research_expression"], "conflicts_with": []},
    "capability_bindings": [{"contribution_id": "research_context_routes", "claim_ids": ["research_context_routing"]}],
    "task_projections": [],
    "routing": {"trigger_intents": ["material_understanding", "idea_diagnosis", "research_self_model"], "non_goals": ["private_sibling_discovery", "public_profile_generation", "canonical_direct_write"], "handoff_to": [{"kind": "capability", "id": "research_expression", "availability": "if_available"}, {"kind": "core_route", "id": "review", "availability": "required"}]},
    "admission": {"maturity": "instrumented", "proof_refs": ["evals/test_public_capability_alignment.py"], "last_reviewed": "2026-08-25", "revalidation_triggers": ["task_route_change", "public_boundary_change", "model_baseline_change"], "retirement_condition": "Retire when the host supplies equal context precision and privacy discipline."}
  },
  "authority": {"source": "User-selected sources and public-safe repository files retain factual authority.", "candidate": "Context receipts and inferred links remain candidates.", "confirmation": "Human confirmation is required before durable writeback or external reuse.", "save_target": "Use answer, artifact, or Review; this plugin owns no storage.", "requires_human_confirmation": true, "writeback_route": "review", "storage_owner": "researchos_core"},
  "permissions": {"read_paths": [], "network_domains": [], "command_ids": [], "state_access": "none", "canonical_write": false},
  "contributions": {"tasks": [], "actions": [], "candidate_types": [{"id": "research_context_receipt"}], "asset_types": [], "source_adapters": [], "previewers": [], "projections": [], "ui_slots": [], "work_item_providers": []},
  "state_namespace": "researchos.plugin.research_context",
  "lifecycle": {"install": "release_bundled", "enable": "manifest_flag", "disable": "manifest_flag", "uninstall": "release_change", "migrations": []},
  "validation": {"commands": ["python3 scripts/validate_plugins.py"], "behavior_tests": ["python3 -m unittest evals.test_public_capability_alignment"]}
}
